Job Title,Job Post Url,Company Name,Location,Job ID,Job Descriptions
Data & Applied Scientist Ii,https://www.linkedin.com/jobs/view/4014564625/?eBP=CwEAAAGR8LYmUhUnQIBDpqN3U402DPTW9Ff-0GpFPxh8uH8Fb2vDjkbKn72bnbUkPVGr0RTfQ9rEmoECQ4mfnpjGMovg5ewUUhJEPEbIGqYt2y3uz_ZzwvupmNh4jMG0UT7t5exRLU6Em315GNM--t7YRT4iAju9OCDL8UwC4NfzwU8zJZZ9thwcRjAU-OhwpDziaM0v8aKHknw-spHwOufj57eSsrxDx3PoueQoM6-QJj7z971SGthIPNfU1YCoIrmicDNrbzaQA3K7EjzUjhkkmDyjeGKnXsl7Xd8T9RvcYPUrGS7zqNrpqP8xFuXZrg2dULRnZ09l84keJk3XlOX1V7d16VEZRdEtcEkANv26ggpVI2wdRR7Wy7ZgCOuG-qvD2IuEs3ZajSX-2FxobiLLag6r06VHC1cjvnV5Ada0gRmpxZnusOEYzf_tR8tUUeZpQ36ouRnkgcWsGgnSbCiEYxb2Hp1248zwpSOklg&refId=qxRihemt7URafeYPCJRBUQ%3D%3D&trackingId=3SauKCUPFoifKEU0D%2FTIDA%3D%3D&trk=flagship3_search_srp_jobs,Microsoft,"Mizoram, India (Hybrid)",4014564625,"Microsoft’s Cloud business is experiencing explosive growth, and the Cloud Supply Chain (CSCP) organization is responsible for enabling the infrastructure underlying this growth. Our mission is to deliver the world’s computer with an industry-leading supply chain. CSCP is responsible for strategic sourcing, customer demand forecasting, capacity planning and management, supply chain planning and execution, capacity provisioning, and decommissioning and dispositioning of datacenter assets worldwide.

Mirosoft Cloud Planning is one of the most central functions within CSCP due to its direct impact on Microsoft cloud business success. This team forecasts, plans and manages the majority of Microsoft’s cloud services and directly influences cloud user experience. This is a central function that closely partners with Engineering, Finance, Supply Chain, Data Centers, NPI and Deployment Engineering.

India Center-of-Excellence (CoE) is a comparatively new team which offers capabilities to make planning processes efficient and best-in-industry by bringing expertise in areas like Supply Chain Management, Data Science, Engineering and Analytics. The team is growing very fast to get ahead of the Cloud Supply Chain demand increase and set up practices for structured long, medium and short-range planning.

Responsibilities

Responsibilities:

Researching and developing production-grade models (forecasting, anomaly detection, optimization, clustering, etc.) for our global cloud business by using statistical and machine learning techniques.
Manage large volumes of data, and create new and improved solutions for data collection, management, analyses, and data science model development.
Drive the onboarding of new data and the refinement of existing data sources through feature engineering and feature selection.
Apply statistical concepts and cutting-edge machine learning techniques to analyze cloud demand and optimize our data science model code for distributed computing platforms and task automation.
Work closely with other data scientists and data engineers to deploy models that drive cloud infrastructure capacity planning.
Present analytical findings and business insights to project managers, stakeholders, and senior leadership and keep abreast of new statistical / machine learning techniques and implement them as appropriate to improve predictive performance.
Oversees and directs the plan or forecast across the company for demand planning. Evangelizes the demand plan with other leaders.
Drives clarity and understanding of what is required to achieve the plan (e.g., promotions, sales resources, collaborative planning, forecasting, and replenishment [CPFR], budget, engineering changes) and assesses plans to mitigate potential risks and issues.
Oversees the analysis of data and leads the team in identifying trends, patterns, correlations, and insights to develop new forecasting models and improve existing models.
Oversees development of short and long term (e.g., weekly, monthly, quarterly) demand forecasts and develops and publishes key forecast accuracy metrics. Analyzes data to identify potential sources of forecasting error. Serves as an expert resource and leader of demand planning across the company and ensures that business drivers are incorporated into the plan (e.g., forecast, budget).
Leads collaboration among team and leverages data to identify pockets of opportunity to apply state-of-the-art algorithms to improve a solution to a business problem.

Consistently leverages knowledge of techniques to optimize analysis using algorithms.

Modifies statistical analysis tools for evaluating Machine Learning models. Solves deep and challenging problems for circumstances such as when model predictions are not correct, when models do not match the training data or the design outcomes when the data is not clean when it is unclear which analyses to run, and when the process is ambiguous.
Provides coaching to team members on business context, interpretation, and the implications of findings. Interprets findings and their implications for multiple businesses, and champions methodological rigour by calling attention to the limitations of knowledge wherever biases in data, methods, and analysis exist.
Generates and leverages insights that inform future studies and reframe the research agenda. Informs both current business decisions by implementing and adapting supply-chain strategies through complex business intelligence.
Connects across functional teams and the broader organization outside of Demand Planning to advocate for continuous improvement and maintain best practices.
Leads broad governance and rhythm of the business processes that ensure cross-group collaboration, discussion of key issues, and an opportunity to build proposed solutions to address current or future business needs.

Qualifications

Required:

M.Sc. in Statistics, Applied Mathematics, Applied Economics, Computer Science or Engineering, Data Science, Operations Research or similar applied quantitative field
4-8 years of industry experience in developing production-grade statistical and machine learning code in a collaborative team environment.
Prior experience in machine learning using R or Python (scikit / numpy / pandas / statsmodel).
Prior experience in time series forecasting.
Prior experience with typical data management systems and tools such as SQL.
Knowledge and ability to work within a large-scale computing or big data context, and hands-on experience with Hadoop, Spark, DataBricks or similar.
Excellent analytical skills; ability to understand business needs and translate them into technical solutions, including analysis specifications and models.
Creative thinking skills with emphasis on developing innovative methods to solve hard problems under ambiguity and no obvious solutions.
Good interpersonal and communication (verbal and written) skills, including the ability to write concise and accurate technical documentation and communicate technical ideas to non-technical audiences.

Preferred

PhD in Statistics, Applied Mathematics, Applied Economics, Computer Science or Engineering, Data Science, Operations Research or similar applied quantitative field.
Experience in machine learning using R or Python (scikit / numpy / pandas / statsmodel) with skill level at or near fluency.
Experience with deep learning models (e.g., tensorflow, PyTorch, CNTK) and solid knowledge of theory and practice.
Practical and professional experience contributing to and maintaining a large code base with code versioning systems such as Git.
Knowledge of supply chain models, operations research techniques, optimization modelling and solvers.

Microsoft is an equal opportunity employer. Consistent with applicable law, all qualified applicants will receive consideration for employment without regard to age, ancestry, citizenship, color, family or medical care leave, gender identity or expression, genetic information, immigration status, marital status, medical condition, national origin, physical or mental disability, political affiliation, protected veteran or military status, race, ethnicity, religion, sex (including pregnancy), sexual orientation, or any other characteristic protected by applicable local laws, regulations and ordinances. If you need assistance and/or a reasonable accommodation due to a disability during the application process, read more about requesting accommodations.
Show more Show less"
Data and Applied Scientist II,https://www.linkedin.com/jobs/view/3977756201/?eBP=CwEAAAGR8LYmUp6EZnU_5XWa35s7lOir8nKDf1uw9NU5fCcOPDZZkSVg6WFWSOJNxyYdIWjUyiAgX88V4-A1OsLUzY_d1iTFKyuFVk9YDoeFr9H3jox1Uag3mR8BN1L4PtafHYq7XQhZeBsEpI50UPYv-OfWD8Pn6yNkhvDXXBT6f2eXf6m5--3fY30gTcaJiVOjkQMITQugEDwcqNO-q7muVEsSYT4zykzKzLqzrSWL4ayYWKws0PJphNNVAG50dmNfB6fjay2SWO8KvkFWpbhipqCDRa7umy-LbszsH1BL00ew2RqCBh8c3woB1PzGuJZQz6jS-D5SwQnFkwZsD_KUWiHvIcNihemrieJvSi7YBGuBuW830gTsraHs6PFyKocL1r03nVQOdYWSQUwXhXt-hVq7Og_vv-tjlPPVCfaYUmK0Zs8w1CgCaYHAhH8dtrOzHz9ENKbTkvl5fzcf_bULH6rkpxc6RvYds-M&refId=qxRihemt7URafeYPCJRBUQ%3D%3D&trackingId=uSQfxeP%2BNu04yqbyPxa5Sg%3D%3D&trk=flagship3_search_srp_jobs,Microsoft,"Manipur, India (Hybrid)",3977756201,"Microsoft’s Cloud business is experiencing explosive growth, and the Cloud Supply Chain (CSCP) organization is responsible for enabling the infrastructure underlying this growth. Our mission is to deliver the world’s computer with an industry-leading supply chain. CSCP is responsible for strategic sourcing, customer demand forecasting, capacity planning and management, supply chain planning and execution, capacity provisioning, and decommissioning and dispositioning of datacenter assets worldwide.

Microsoft Cloud Planning is one of the most central functions within CSCP due to its direct impact on Microsoft cloud business success. This team forecasts, plans and manages the majority of Microsoft’s cloud services and directly influences cloud user experience. This is a central function that closely partners with Engineering, Finance, Supply Chain, Data Centers, NPI and Deployment Engineering.

India Center-of-Excellence (CoE) is a comparatively new team which offers capabilities to make planning processes efficient and best-in-industry by bringing expertise in areas like Supply Chain Management, Data Science, Engineering and Analytics. The team is growing very fast to get ahead of the Cloud Supply Chain demand increase and set up practices for structured long, medium and short-range planning.

Responsibilities

Responsibilities:

Researching and developing production-grade models (forecasting, anomaly detection, optimization, clustering, etc.) for our global cloud business by using statistical and machine learning techniques.
Manage large volumes of data, and create new and improved solutions for data collection, management, analyses, and data science model development.
Drive the onboarding of new data and the refinement of existing data sources through feature engineering and feature selection.
Apply statistical concepts and cutting-edge machine learning techniques to analyze cloud demand and optimize our data science model code for distributed computing platforms and task automation.
Work closely with other data scientists and data engineers to deploy models that drive cloud infrastructure capacity planning.
Present analytical findings and business insights to project managers, stakeholders, and senior leadership and keep abreast of new statistical / machine learning techniques and implement them as appropriate to improve predictive performance.
Oversees and directs the plan or forecast across the company for demand planning. Evangelizes the demand plan with other leaders.
Drives clarity and understanding of what is required to achieve the plan (e.g., promotions, sales resources, collaborative planning, forecasting, and replenishment [CPFR], budget, engineering changes) and assesses plans to mitigate potential risks and issues.
Oversees the analysis of data and leads the team in identifying trends, patterns, correlations, and insights to develop new forecasting models and improve existing models.
Oversees development of short and long term (e.g., weekly, monthly, quarterly) demand forecasts and develops and publishes key forecast accuracy metrics. Analyzes data to identify potential sources of forecasting error. Serves as an expert resource and leader of demand planning across the company and ensures that business drivers are incorporated into the plan (e.g., forecast, budget).
Leads collaboration among team and leverages data to identify pockets of opportunity to apply state-of-the-art algorithms to improve a solution to a business problem.

Consistently leverages knowledge of techniques to optimize analysis using algorithms.

Modifies statistical analysis tools for evaluating Machine Learning models. Solves deep and challenging problems for circumstances such as when model predictions are not correct, when models do not match the training data or the design outcomes when the data is not clean when it is unclear which analyses to run, and when the process is ambiguous.
Provides coaching to team members on business context, interpretation, and the implications of findings. Interprets findings and their implications for multiple businesses, and champions methodological rigor by calling attention to the limitations of knowledge wherever biases in data, methods, and analysis exist.
Generates and leverages insights that inform future studies and reframe the research agenda. Informs both current business decisions by implementing and adapting supply-chain strategies through complex business intelligence.
Connects across functional teams and the broader organization outside of Demand Planning to advocate for continuous improvement and maintain best practices.
Leads broad governance and rhythm of the business processes that ensure cross-group collaboration, discussion of key issues, and an opportunity to build proposed solutions to address current or future business needs.

Qualifications

Required:

M.Sc. in Statistics, Applied Mathematics, Applied Economics, Computer Science or Engineering, Data Science, Operations Research or similar applied quantitative field
4-8 years of industry experience in developing production-grade statistical and machine learning code in a collaborative team environment.
Prior experience in machine learning using R or Python (scikit / numpy / pandas / statsmodel).
Prior experience in time series forecasting.
Prior experience with typical data management systems and tools such as SQL.
Knowledge and ability to work within a large-scale computing or big data context, and hands-on experience with Hadoop, Spark, DataBricks or similar.
Excellent analytical skills; ability to understand business needs and translate them into technical solutions, including analysis specifications and models.
Creative thinking skills with emphasis on developing innovative methods to solve hard problems under ambiguity and no obvious solutions.
Good interpersonal and communication (verbal and written) skills, including the ability to write concise and accurate technical documentation and communicate technical ideas to non-technical audiences.

Preferred

PhD in Statistics, Applied Mathematics, Applied Economics, Computer Science or Engineering, Data Science, Operations Research or similar applied quantitative field.
Experience in machine learning using R or Python (scikit / numpy / pandas / statsmodel) with skill level at or near fluency.
Experience with deep learning models (e.g., tensorflow, PyTorch, CNTK) and solid knowledge of theory and practice.
Practical and professional experience contributing to and maintaining a large code base with code versioning systems such as Git.
Knowledge of supply chain models, operations research techniques, optimization modelling and solvers.

Microsoft is an equal opportunity employer. Consistent with applicable law, all qualified applicants will receive consideration for employment without regard to age, ancestry, citizenship, color, family or medical care leave, gender identity or expression, genetic information, immigration status, marital status, medical condition, national origin, physical or mental disability, political affiliation, protected veteran or military status, race, ethnicity, religion, sex (including pregnancy), sexual orientation, or any other characteristic protected by applicable local laws, regulations and ordinances. If you need assistance and/or a reasonable accommodation due to a disability during the application process, read more about requesting accommodations.
Show more Show less"
Data Scientist,https://www.linkedin.com/jobs/view/4015129534/?eBP=CwEAAAGR8LYmUtO7d92OlUZosAj8ruzLWN9lTeCMX3iE86l0cRMJOmVgvCmUx3wqX0-Y7VV1GtjjLvcw7qtkR_rQckvUEhG_Ie7jbCVTNlCYcTurWZyr_1UGnzjhpA7JFgUywQOpFVsRquQj1BENaQGLcsF39Vg6dwU4nNNfa9PPCNqfrlDp6fMeX1V4-W0cbfIYuRGyLKekzDSMyJW-XC8eME6f_d9ddHvTGG8ZCx_Q7-T0OvIo71t1yPWXNH0yLjOtAcQvv-xAqqQkPtYiXvvmT4t-vLAWR7nihageFuqNLe6K616e1LtJMNZuR8Kt2P3AfnVKPW0GHWJmMyvfsle5ZbnJAig3rNUx7ZyRNVvoUWtwRCe_-c8Vkp_7m_95FYVjbXudqxRtop6O66ZkQcgznpyUPqcQ09oPUMs9fKoWSxh1xBF1C1MpgVzmNGW7ppMJ&refId=qxRihemt7URafeYPCJRBUQ%3D%3D&trackingId=%2BW5Za%2FVDK04Vtz7zqtauCg%3D%3D&trk=flagship3_search_srp_jobs,IBM,"Bengaluru East, Karnataka, India (Hybrid)",4015129534,"Introduction

As a Data Scientist at IBM, you will help transform our clients’ data into tangible business value by analyzing information, communicating outcomes and collaborating on product development. Work with Best in Class open source and visual tools, along with the most flexible and scalable deployment options. Whether it’s investigating patient trends or weather patterns, you will work to solve real world problems for the industries transforming how we live.

Your Role and Responsibilities


Data powers the insights companies use to transform the way they work. Do you enjoy analyzing data to push marketers to take actions that improve their performance? Do you have proven experience finding actionable insights in large data sets that lead to measurable business results?
The Performance Analytics team directly impacts the direction of the marketing organization and all of IBM. We provide insights that drive both strategic and tactical outcomes for the company and directly guide marketing execution.
As a Data Scientist, you will work with business stakeholders, engineers, marketing and sales teams to use analytical insights to develop strategies for end-to-end campaign implementation and execution.
You will get exposure to all aspects of marketing, from early-stage audience targeting via paid media investment, to capturing demand through our web presence, to response to lead management and sales analytics.
In this role, you will have the opportunity to focus on synthesizing and applying analytic insights during the execution phase to improve performance for a particular business area, project or trial.
Perform complex quantitative analyses to evaluate customer engagement and the impact of marketing activities on-demand generation, including pipeline, revenue, content engagement, media spend optimization, routing, channel performance, lead conversion, pipeline yield and ROI, and other key strategic levers
Utilize proprietary and external data to analyze IBM’s target audience segmentation and create recommendations for improving the user experience at all stages of the journey and identifying the right audience for targeting
Measure performance and establish new measurement systems to detect performance shifts and increase marketing effectiveness
Develop and lead execution of analytics projects for business use cases aligned to business strategies
Design and present data-driven optimization recommendations via dashboards, reports, and analyses
Communicate insights to team members, other marketing groups, and IBM leadership
We maintain a responsible consideration of health and safety practices and ongoing support for a hybrid office, in-office/remote office balance.""


Required Technical and Professional Expertise


7+ years relevant analytics work experience in marketing analytics, including experience in a data-driven technology business or company with a sophisticated data stack
Technically skilled to perform complex data querying and work with complex data models using Advanced SQL/Python or other query and programming tools to process and analyze data
Demonstrates a strong ability to analyze and manipulate marketing data and work on complex data flows across systems
Thought leadership in working on functional objectives and shaping an analytical solution
Ability to perform root-cause analysis with limited supervision
Deep critical thinking skills and curiosity to pursue open-ended problems via data
Strong presentation skills and ability to effectively communicate complicated analyses to non-technical employees and leadership
Business acumen with the ability to develop data-driven business recommendations
Demonstrated ability to multitask with minimum supervision and prioritize with a proven ability to meet tight deadlines


Preferred Technical And Professional Expertise


Master’s degree in Mathematics / Statistics / Economics / Applied Statistics / Applied Mathematics / Computer Programming / Analytics / Data Science is a strong plus.
Relevant work experience in customer analytics, digital marketing analytics and web analytics is a plus.
Hands-on experience in build, deploy and automation of complex data flows involving sequential loops, multiple merge, data imputation, normalizing data is a strong plus


About Business Unit

IBM Corporate Headquarters (CHQ) team represents a variety of functions such as marketing, finance, legal, operations, HR, and more, all working together to solve some of the world's most complex problems, help our clients achieve success and build collaborative work environments for IBMers.

This job requires you to be fully COVID-19 vaccinated prior to your start date and proof of vaccination status will be required before your start date. During the Onboarding process you will be asked to confirm your vaccination status, in case you are unable to get vaccinated for any reason, you can let us know at that stage. Please let us know if you are unable to be vaccinated due to medical or religious reasons. IBM will consider such requests on a case by case basis subject to submission of required proof by the candidate before a stipulated date.

Your Life @ IBM

In a world where technology never stands still, we understand that, dedication to our clients success, innovation that matters, and trust and personal responsibility in all our relationships, lives in what we do as IBMers as we strive to be the catalyst that makes the world work better.

Being an IBMer means you’ll be able to learn and develop yourself and your career, you’ll be encouraged to be courageous and experiment everyday, all whilst having continuous trust and support in an environment where everyone can thrive whatever their personal or professional background.

Our IBMers are growth minded, always staying curious, open to feedback and learning new information and skills to constantly transform themselves and our company. They are trusted to provide on-going feedback to help other IBMers grow, as well as collaborate with colleagues keeping in mind a team focused approach to include different perspectives to drive exceptional outcomes for our customers. The courage our IBMers have to make critical decisions everyday is essential to IBM becoming the catalyst for progress, always embracing challenges with resources they have to hand, a can-do attitude and always striving for an outcome focused approach within everything that they do.

Are you ready to be an IBMer?

About IBM

IBM's greatest invention is the IBMer. We believe that through the application of intelligence, reason and science, we can improve business, society and the human condition, bringing the power of an open hybrid cloud and AI strategy to life for our clients and partners around the world.

Restlessly reinventing since 1911, we are not only one of the largest corporate organizations in the world, we’re also one of the biggest technology and consulting employers, with many of the Fortune 50 companies relying on the IBM Cloud to run their business.

At IBM, we pride ourselves on being an early adopter of artificial intelligence, quantum computing and blockchain. Now it’s time for you to join us on our journey to being a responsible technology innovator and a force for good in the world.

Location Statement

When applying to jobs of your interest, we recommend that you do so for those that match your experience and expertise. Our recruiters advise that you apply to not more than 3 roles in a year for the best candidate experience.

For additional information about location requirements, please discuss with the recruiter following submission of your application.

Being You @ IBM

IBM is committed to creating a diverse environment and is proud to be an equal-opportunity employer. All qualified applicants will receive consideration for employment without regard to race, color, religion, sex, gender, gender identity or expression, sexual orientation, national origin, caste, genetics, pregnancy, disability, neurodivergence, age, veteran status, or other characteristics. IBM is also committed to compliance with all fair employment practices regarding citizenship and immigration status.
Show more Show less"
