Job Title,Job Post Url,Company Name,Location,Job ID,Job Descriptions
Data Scientist,https://www.linkedin.com/jobs/view/4008948675/?eBP=CwEAAAGR8LYg_SOR8qSyBR6ZvCjVT1bR9s4U1HVsMcS46V0YMcbe5408oebGAElVarwsOE7cok1q8g1Ef-k-oK29Rc4NBoqwXimPhUBgaXyUHk-wNHvSFx4zBgvPExH15hYUJxlDDrIZnC51-oqYqgTqZMZcIwRvzi1sa0IOMsUBwHAEO9vJyYlFazQM0ykdZ0v_rxxCLuAXkxLAMA5VLTQMT9VERE4-V4JRFvS2-GqE4MxgXO7trfmg9KVGbzdG6eea8QiDbIduEVHaBvimfugovfVoKdmjawTImGKROAQfvc22gpc2HVJio28zSGWYse5k-YIKWjrisR5hL3iSihagaXkl_XIWprpin4oUgeaV0alWOzIa-_SkK8fkVWmG_MnJ-F6IvTHcWErmi8vZVCsAhqr_68oBhlf3yRbe6SCgoGflxvw_z_AEfWwQssvUCZqgZCV0oUgh6V6dIzVs0hUBgBhdj3cY3Dj1&refId=F8PxQ22KB1Tkuy1IzJ7mqg%3D%3D&trackingId=8BBEkXUF0CoZJczuj%2B%2F96Q%3D%3D&trk=flagship3_search_srp_jobs,Tata Consultancy Services,Greater Bengaluru Area (On-site),4008948675,"Greetings from TCS!

Job skill: Data Scientist
Required Skill: Data Science Algorithms, Azure ML/OPS, AWS, Google Cloud AI services, Python
Experience: 5-10 years
Location: Kolkata/Bangalore/Pune/Bhubaneswar /Delhi

NOTE: Virtual Interview will be conducted on 29th Aug 2024 (Thursday)

JOB DESCRIPTION:

Must-Have:
Need Both theoretical and practical idea about basic data science algorithms of Regressing, Clustering, Classification, Natural Language processing, Deep Learning, time series forecasting. Also, must have a clear idea about the applicability of those.
Should be very through about the deep learning concepts of CNN, RNN, Transformer models
Should be able to create chain of serverless multimodal architecture, consisting of many AI models in the chain
Must be strong in python programming, Model training and testing
Must know one of the ML –OPS technology either of the following Cloud Offering Azure, AWS or Google.

Good To Have:
Working knowledge of Azure DevOps
Working knowledge of LLM, GAN and other generative models at least in the theoretical level
Good to have basic application packaging and API concepts




Thanks & Regards,
Ria Aarthi A.
Show more Show less"
Senior Data Scientist,https://www.linkedin.com/jobs/view/4011958083/?eBP=CwEAAAGR8LYg_edAgWcpE5jO6rXCqz2_vf8BFGStCUoyTdTEB7D9-e3HZvJ0k9z-QlEeiOmk6Mr-ytc-q6eWzoVjQmzQLPmqfsmROAfr_WX66cuz6N5AFfodiJLaID3KwoUV65K2I3AfjT24uz4kffP9ISYpfw85Am3T5GKVGTTYQ0ACAIcEdOO3k_l1Wo1fp6hrAFh3yN6dU8UkH2j4xUkplwu-dczATndA4onZo6elNzGMEkopnX99L2QJ9WDbcntPLd1C__xb9c3xTr0DMY62ZT8eiGC34eXZQq1csjYONRJq5fak743tJqJ9KHXofFNNHItIB95dfaE60k_vU_7fuMbVzLWdmaOEZWZ22OOcuGu-vOWxwZap3auvEcbOD_U8YrS1TW89_0hCjVjF5mxR0ZVPjsD_JtCWKD2vNMAu-8D1jdHSvQshXhPLYcKaieHYhm9pMZvPn5S4FfOy45CrHmrvtcjGRMQ75AY&refId=F8PxQ22KB1Tkuy1IzJ7mqg%3D%3D&trackingId=a4rGW5A9tlWxEu3PENVAXQ%3D%3D&trk=flagship3_search_srp_jobs,EdgeVerve,"Bangalore Urban, Karnataka, India (On-site)",4011958083,"EdgeVerve, a fully owned subsidiary of Infosys Limited, is a global leader in AI, Automation, and Analytics. Our technology empowers enterprises globally to bring life to their digital transformation initiatives.

We are not just building path-breaking products; we are building technology that will unlock hidden business value from your business processes, documents, and supply chain.

Our digital platforms help clients capitalize on the inherent power of a connected enterprise. We do this by amplifying the human potential, crafting connected customer journeys and exploiting the power of value networks.

Job Role- Senior Data scientist
Location- Bangalore

Drive AI first solution and bring out industry leading cutting-edge AI solutions
Provide an end-to-end AI based solution that excels in real client use-cases around Information Extraction
Collaborate with cross functional teams (Product and Solution teams) and ensure that the AI solution is comprehensive as required by the use case
Abreast with latest trends in AI technologies and provide technical leadership to execute large-scale, complex search solutions
Help attract and recruit technical talent in the domain of Information Extraction
Minimum 10+years of software development experience with 7+ years in creating AI solutions
High proficiency and experience in the following
1. Experience in ML, NLP/NLU, Computer Vision, Narrow LM (BERT), General LLM, Gen AI

1.Good hold over unsupervised learning, supervised learning, reinforcement learning and generative models
2. Advanced knowledge of the Hugging Face (transformers, tokenizers, accelerate) and Langchain libraries
3. Build, versioning and maintaining AI models along with performance optimizations to run at scale
4. Create and maintain training data from large knowledge bases consisting of semantic relationships.
5. Experience with other NLP libraries like nltk, spacy, genism, etc
6. Expertise in programming languages commonly used in AI development, such as Python and proficiency in libraries like NumPy and Pandas.

Preferred
PhD/master's degree in computer science, or Math or related field
We need technical depth and an appreciation of business imperatives, we want to use technology to solve real-world problems, not indulge in over-engineering
Experience with multilingual NLP
A willingness to dive deep, experiment rapidly and get things done.
Exceptional customer relationship skills including the ability to understand common technical requirements from multiple feature requests and lead engineering efforts to meet timelines with optimal solutions.
Experience with Agile/Lean (Kanban, SCRUM), http / REST services, Linux.
Proven experience mentoring and training the engineering community on complex technical issues.
Show more Show less"
Lead Data Scientist,https://www.linkedin.com/jobs/view/4012679936/?eBP=CwEAAAGR8LYg_V2FZna46BQgVncCvi393UOnErYz2zQTCxFQIZACDmEhQujIUseES-wdMK0id-0NQ_62Fjt0dC2q1jZbrb4dSZobLT69gNOCRL9C8unzjTUjBz0eHaT8Gl6-OB5tFrjaz_nTpAGEO0CMhvMhQyNFWR_Av5RRjo-RfSIXo9co9mVhewSTDshKG8Cqie0vIZ5fFC4qbOmT9faO3AE1BL2F0nxNkQcDSssUADvhke1gifVBGuDMKFfxSZn0ZXRPUJAa-a_cvjRzAJqtqe7ojj18TEVL0jmw7S4lZggDexk1X2PfCKvrAPmri7UJnhm25LaqLQ37aDyR7v10Z9wCS-FCaLyfnAIZfUFzZ6I01LvDYkUwdtD-6NGdS5o_7R-FfzXe3swMLD36S9L5i8NKbrOf300to4_7kCgulCQN0q8iTBOG8B1shjYFOIPBHKfNNi1UiKHdKJnFC47SlrNTu0H_YLAvAsc&refId=F8PxQ22KB1Tkuy1IzJ7mqg%3D%3D&trackingId=pmMPcIxgYLYJpG52o6%2BvLA%3D%3D&trk=flagship3_search_srp_jobs,Tatvic ®,"Ahmedabad, Gujarat, India (On-site)",4012679936,"Mandatory Skills:
Cloud Services: GCP/AWS/Azure
Predictive Modelling, Gen AI, Recommendation Engine, Python, SQL, ML
Years of experience: 4+ years

Location: Ahmedabad

Responsibilities w.r.t Customer:
Keep the promises made to the customer in terms of deliverables.
Designing solutions using data science platforms.
Bird’s eye view of the Platform to create an effective solution
Identify features which would matter and ensure that logic for feature selection is clear to all
Use Auto ML as well as individual algorithms for effective solutions
Display or export the output into a visualization platform
Create an API which can be used to access the model for query
Optimize the model to increase the effectiveness with proper data cleansing and feature engineering
Create a POC for providing data insight for the customer at a short notice
Innovation and Asset building Responsibilities
Design and Build reusable solution which can be used for multiple customers
Create clear documentation on architecture and design concepts used in the project
Provide assistance to other team members to learn cloud platform by training and creating the presentation
Maintain coding standards & Building reusable code and libraries for future use
Stay updated with new innovations in data science.
Explore the usage of data science in various business and web analytics applications
Show more Show less"
Data & Applied Scientist Ii,https://www.linkedin.com/jobs/view/4014567237/?eBP=CwEAAAGR8LYg_aKFznn1qqsPx12IYD2vK0695AH3HuBPspZiJ6aHbGVIYQRdh9queU9o5mWjUGDJ8d_MlzP3oYrphvvPY2O4t7gETYtRdbJrWehwjLNCgt9n_CDqrSN69oCrCV_bp1EXGvi1rsnr6CZiv8zmqUDMITQmBgG4zcAYlDwqBmDjuHxDC5vfH35eH_yXGQUeGHc61cX7DiPKW2hBSVRTEOi5DsO-L8ZReHyF1Z7FwwF-3hlpyMM-J2mCfDEfvh4cRp-z7_84UvwD_CWQeqnHQBFTmDW3BB-kcqc4x7joxkOjZfjBTMX8q31FA5ituLkW9OUDVUPuvEvMuoAQEGXYsOJvk_zM1USMk4oWogUgN516jONq5wqE-a16Yij_T7Rxij8dTPmeqEVfZhiugNVQapsICGp2VsxOeN2u3OfGHVdrADe8ZSgD2UDb8MuRQl3SIHm65v7lHWviojsSj8OoZnA--oHf_rU&refId=F8PxQ22KB1Tkuy1IzJ7mqg%3D%3D&trackingId=k4vofBWrJPs17lISwl8qzQ%3D%3D&trk=flagship3_search_srp_jobs,Microsoft,"Jammu & Kashmir, India (Hybrid)",4014567237,"Microsoft’s Cloud business is experiencing explosive growth, and the Cloud Supply Chain (CSCP) organization is responsible for enabling the infrastructure underlying this growth. Our mission is to deliver the world’s computer with an industry-leading supply chain. CSCP is responsible for strategic sourcing, customer demand forecasting, capacity planning and management, supply chain planning and execution, capacity provisioning, and decommissioning and dispositioning of datacenter assets worldwide.

Mirosoft Cloud Planning is one of the most central functions within CSCP due to its direct impact on Microsoft cloud business success. This team forecasts, plans and manages the majority of Microsoft’s cloud services and directly influences cloud user experience. This is a central function that closely partners with Engineering, Finance, Supply Chain, Data Centers, NPI and Deployment Engineering.

India Center-of-Excellence (CoE) is a comparatively new team which offers capabilities to make planning processes efficient and best-in-industry by bringing expertise in areas like Supply Chain Management, Data Science, Engineering and Analytics. The team is growing very fast to get ahead of the Cloud Supply Chain demand increase and set up practices for structured long, medium and short-range planning.

Responsibilities

Responsibilities:

Researching and developing production-grade models (forecasting, anomaly detection, optimization, clustering, etc.) for our global cloud business by using statistical and machine learning techniques.
Manage large volumes of data, and create new and improved solutions for data collection, management, analyses, and data science model development.
Drive the onboarding of new data and the refinement of existing data sources through feature engineering and feature selection.
Apply statistical concepts and cutting-edge machine learning techniques to analyze cloud demand and optimize our data science model code for distributed computing platforms and task automation.
Work closely with other data scientists and data engineers to deploy models that drive cloud infrastructure capacity planning.
Present analytical findings and business insights to project managers, stakeholders, and senior leadership and keep abreast of new statistical / machine learning techniques and implement them as appropriate to improve predictive performance.
Oversees and directs the plan or forecast across the company for demand planning. Evangelizes the demand plan with other leaders.
Drives clarity and understanding of what is required to achieve the plan (e.g., promotions, sales resources, collaborative planning, forecasting, and replenishment [CPFR], budget, engineering changes) and assesses plans to mitigate potential risks and issues.
Oversees the analysis of data and leads the team in identifying trends, patterns, correlations, and insights to develop new forecasting models and improve existing models.
Oversees development of short and long term (e.g., weekly, monthly, quarterly) demand forecasts and develops and publishes key forecast accuracy metrics. Analyzes data to identify potential sources of forecasting error. Serves as an expert resource and leader of demand planning across the company and ensures that business drivers are incorporated into the plan (e.g., forecast, budget).
Leads collaboration among team and leverages data to identify pockets of opportunity to apply state-of-the-art algorithms to improve a solution to a business problem.

Consistently leverages knowledge of techniques to optimize analysis using algorithms.

Modifies statistical analysis tools for evaluating Machine Learning models. Solves deep and challenging problems for circumstances such as when model predictions are not correct, when models do not match the training data or the design outcomes when the data is not clean when it is unclear which analyses to run, and when the process is ambiguous.
Provides coaching to team members on business context, interpretation, and the implications of findings. Interprets findings and their implications for multiple businesses, and champions methodological rigour by calling attention to the limitations of knowledge wherever biases in data, methods, and analysis exist.
Generates and leverages insights that inform future studies and reframe the research agenda. Informs both current business decisions by implementing and adapting supply-chain strategies through complex business intelligence.
Connects across functional teams and the broader organization outside of Demand Planning to advocate for continuous improvement and maintain best practices.
Leads broad governance and rhythm of the business processes that ensure cross-group collaboration, discussion of key issues, and an opportunity to build proposed solutions to address current or future business needs.

Qualifications

Required:

M.Sc. in Statistics, Applied Mathematics, Applied Economics, Computer Science or Engineering, Data Science, Operations Research or similar applied quantitative field
4-8 years of industry experience in developing production-grade statistical and machine learning code in a collaborative team environment.
Prior experience in machine learning using R or Python (scikit / numpy / pandas / statsmodel).
Prior experience in time series forecasting.
Prior experience with typical data management systems and tools such as SQL.
Knowledge and ability to work within a large-scale computing or big data context, and hands-on experience with Hadoop, Spark, DataBricks or similar.
Excellent analytical skills; ability to understand business needs and translate them into technical solutions, including analysis specifications and models.
Creative thinking skills with emphasis on developing innovative methods to solve hard problems under ambiguity and no obvious solutions.
Good interpersonal and communication (verbal and written) skills, including the ability to write concise and accurate technical documentation and communicate technical ideas to non-technical audiences.

Preferred

PhD in Statistics, Applied Mathematics, Applied Economics, Computer Science or Engineering, Data Science, Operations Research or similar applied quantitative field.
Experience in machine learning using R or Python (scikit / numpy / pandas / statsmodel) with skill level at or near fluency.
Experience with deep learning models (e.g., tensorflow, PyTorch, CNTK) and solid knowledge of theory and practice.
Practical and professional experience contributing to and maintaining a large code base with code versioning systems such as Git.
Knowledge of supply chain models, operations research techniques, optimization modelling and solvers.

Microsoft is an equal opportunity employer. Consistent with applicable law, all qualified applicants will receive consideration for employment without regard to age, ancestry, citizenship, color, family or medical care leave, gender identity or expression, genetic information, immigration status, marital status, medical condition, national origin, physical or mental disability, political affiliation, protected veteran or military status, race, ethnicity, religion, sex (including pregnancy), sexual orientation, or any other characteristic protected by applicable local laws, regulations and ordinances. If you need assistance and/or a reasonable accommodation due to a disability during the application process, read more about requesting accommodations.
Show more Show less"
Expert Data Scientist,https://www.linkedin.com/jobs/view/4004917664/?eBP=CwEAAAGR8LYg_WeQzOdiWXQ5b4uzarVyhacwRlnJc1Ku5Mv6w_BsyYlPKDRXJHhhT_4YirUHEsGo5xqFJQtVvfnrjZXE9xmrM2r2rx5WmUY7fhwJAd3Gg9YzG9DP1uEL1snEpFRzSyLc5tu2Kf8LmwYBl7OaQ8V1_AQsST4DT9cey80eX7uqGlqFhJg1SaIv0PRKC4iRlTX5j8B_1rRpw-1svirzjkBsZq9uU91Qtk8k_sjlsizVOsybFzLYx2FGYG3UU_gueRRxJmIKuV9Vrnz9rlcTfroOjbukgImDWTE-pTGXEbPV6G3Pw9XTjmtP3iNEyMj_V3ST989i7_Epb4ep4qI1IDoejbJZsIy-35chOT62UgzRj2qJNqWzPkaRoEbJm8XPLAT99h9U3SCRUx5sPzdekkhNWps2Je-P2nmo5i7aqqDBUuxjoDC65NRETRyJH0kEe7R0hl8ghvorRiN9DfDphLBD&refId=F8PxQ22KB1Tkuy1IzJ7mqg%3D%3D&trackingId=PotPPFgojdTIVTVV5ystgw%3D%3D&trk=flagship3_search_srp_jobs,Ciklum,"Chennai, Tamil Nadu, India (Hybrid)",4004917664,"Ciklum is looking for an Expert Data Scientist to join our team full-time in India.

We are a custom product engineering company that supports both multinational organizations and scaling startups to solve their most complex business challenges. With a global team of over 4,000 highly skilled developers, consultants, analysts and product owners, we engineer technology that redefines industries and shapes the way people live.

About the role:
As an Expert Data Scientist, become a part of a cross-functional development team engineering experiences of tomorrow.

Responsibilities:
Development of prototype solutions, mathematical models, algorithms, machine learning techniques, and robust analytics to support analytic insights and visualization of complex data sets
Work on exploratory data analysis so you can navigate a dataset and come out with broad conclusions based on initial appraisals
Provide optimization recommendations that drive KPIs established by product, marketing, operations, PR teams, and others
Interacts with engineering teams and ensures that solutions meet customer requirements in terms of functionality, performance, availability, scalability, and reliability
Work directly with business analysts and data engineers to understand and support their use cases
Work with stakeholders throughout the organization to identify opportunities for leveraging company data to drive business solutions
Drive innovation by exploring new experimentation methods and statistical techniques that could sharpen or speed up our product decision-making processes
Cross-trains other team members on technologies being developed, while also continuously learning new technologies from other team members
Create educational programmes for both experienced Data Scientists and other departments to increase data handling mastery
Contribute to the Unit activities and community building, participate in conferences, and provide excellence in exercise and best practices
Support marketing & sales activities, customer meetings and digital services through direct support for sales opportunities & providing thought leadership & content creation for the service

Requirements:
We know that sometimes, you can’t tick every box. We would still love to hear from you if you think you’re a good fit!
8+ years of experience in Data Science solution development with a proven track record of leveraging analytics to drive significant business impact
Master's degree in Mathematics, Statistics, Computer Science, Operations Research, Econometrics or related field
Probability Theory & Statistics knowledge and intuition as well as understanding of Mathematics behind the Machine Learning
Proven ability to relate and solve business problems through designed-from-scratch machine learning and statistics solutions
Solid practice with CRISP-ML(Q) / TDSP methodology for solving commercial problems
6+ years of experience applying various machine learning techniques: regression, classification, clustering, dimensional reduction, time series prediction, and/or outlier detection, recommendation systems
Understanding of advantages and drawbacks of machine learning algorithms as well as their usage constraints including performance
6+ years of experience in Python development of machine learning solutions and statistical analysis: Pandas, SciPy, Scikit-learn, XGBoost, LightGBM, and/or statsmodels, imbalanced-learn libraries
2+ years of experience in Deep Learning solution development with Tensorflow or Pytorch libraries
Experience diving into data to consider hidden patterns and conducting error analysis
2+ years experience of data visualization: Power BI, Tableau, and/or Python libraries like Matplotlib and Seaborn
Experience with SQL for data processing, data manipulation, sampling, reporting
5+ years experience creating/maintaining OOP Machine Learning solutions
3+ years of experience with MLOps: integration of reliable Machine Learning Pipelines in Production, Docker, containerization, orchestration
4+ years of experience with Clouds (AWS, Azure, GCP) and Clouds AI And ML Services(e.g. Amazon Sage Maker, Azure ML)
Data Science / Machine Learning certifications, or research experience with papers being published
Excellent time and project management skills, with the ability to manage detailed work and communicate project status effectively to all levels
Knowledge and experience of LLM / Generative AI development

Desirable:
PhD degree in Mathematics, Applied Mathematics, Statistics, Econometrics, Operational Research
Prizes in Kaggle competitions
Advanced SQL knowledge with MS SQL/ PostgreSQL experience
Experience with Kubernetes
Experience with Databricks, Snowflake platforms
1+ year of BigData experience, i.e. Hadoop / Spark
Experience with No-SQL, i.e. columnar/graph databases

What's in it for you?
Care: your mental and physical health is our priority. We ensure comprehensive company-paid medical insurance, as well as financial and legal consultation
Tailored education path: boost your skills and knowledge with our regular internal events (meetups, conferences, workshops), Udemy licence, language courses and company-paid certifications
Growth environment: share your experience and level up your expertise with a community of skilled professionals, locally and globally
Flexibility: hybrid work mode at Chennai or Pune
Opportunities: we value our specialists and always find the best options for them. Our Resourcing Team helps change a project if needed to help you grow, excel professionally and fulfil your potential
Global impact: work on large-scale projects that redefine industries with international and fast-growing clients
Welcoming environment: feel empowered with a friendly team, open-door policy, informal atmosphere within the company and regular team-building events

About us:
India is a strategic growth market for Ciklum.
Be a part of a big story created right now. Let’s grow our delivery center in India together! Boost your skills and knowledge: create and innovate with like-minded professionals — all of that within a global company with a local spirit and start-up soul.
Supported by Recognize Partners and expanding globally, we will engineer the experiences of tomorrow!

bold, not bored!
Interested already? We would love to get to know you! Submit your application. Can’t wait to see you at Ciklum.
Show more Show less"
