Job Title,Job Post Url,Company Name,Location,Job ID,Job Descriptions
Data Scientist,https://www.linkedin.com/jobs/view/4001597048/?eBP=CwEAAAGR8LYmUmSy4MD1F4k0dzYiHPeJan1GLlaSTAy5MO73Pk51BZuFIKFW7O_u63ks2bbexc7LWWRu9r4ZQDMN_hMQYLSTtkoqQMklClNWEEZP6uo44HBrkPtBbhtsd9N-Bk4qyIQBlv6TJhgD-5Cgzn9OQjYeiYyqH3ZIqEQguIAeMbaCcJuV7-yHuKARJUJb99ukr1hr40hLybrrHh5zlBYfS7IWfovyDsk4pA7S0G6RRFEXkQH05kEtXtpswsqYW2WBqJbMXz7X8m-ce3rvdM216o7zFBWkoJUL5lECLeiOTr1G-OUKNHH8F_R5ijaG9dFnx-jibpiATVDLv81Iitp2YzttFRnvzk_d3LFKR0OxVpCuB_xnHF6CbBvwB1wem5puZqVorTl2PcCFCFCulbTEUCLBnCugt1IGutjsPPgy2C6fPzbvYSvWhq2pqsmXFuE2o5Vhe6b1jzyj8Cykguro2UbqkY7AyyFgOxnQvsc&refId=qxRihemt7URafeYPCJRBUQ%3D%3D&trackingId=Aku5zXmi9s5dRQ3PxoUrRA%3D%3D&trk=flagship3_search_srp_jobs,LTIMindtree,"Bengaluru, Karnataka, India (On-site)",4001597048,"Total years of experience - 4 to 15 years

Job Location - Mumbai, Pune, Hyderabad, Chennai, Kolkata, Delhi, Coimbatore

More than 4+ years of experience in Data Engineering, Data Science and AI / ML domain
Excellent understanding of machine learning techniques and algorithms, such as GPTs, CNN, RNN, k-NN, Naive Bayes, SVM, Decision Forests, etc.
Experience using business intelligence tools (e.g. Tableau, PowerBI) and data frameworks (e.g. Hadoop)
Experience in Cloud native skills.
Knowledge of SQL and Python; familiarity with Scala, Java or C++ is an asset
Analytical mind and business acumen and Strong math skills (e.g. statistics, algebra)
Experience with common data science toolkits, such as TensorFlow, KERAs, PyTorch, PANDAs, Microsoft CNTK, NumPy etc. Deep expertise in at least one of these is highly desirable.
Experience with NLP, NLG and Large Language Models like – BERT, LLaMa, LaMDA, GPT, BLOOM, PaLM, DALL-E, etc.
Great communication and presentation skills. Should have experience in working in a fast-paced team culture.
Experience with AIML and Big Data technologies like – AWS SageMaker, Azure Cognitive Services, Google Colab, Jupyter Notebook, Hadoop, PySpark, HIVE, AWS EMR etc.
Experience with NoSQL databases, such as MongoDB, Cassandra, HBase, Vector databases
Good understanding of applied statistics skills, such as distributions, statistical testing, regression, etc.
Should be a data-oriented person with analytical mind and business acumen

Best Regards
Talent Acquisition
LTIMindtree
Show more Show less"
Data Scientist,https://www.linkedin.com/jobs/view/3817877512/?eBP=BUDGET_EXHAUSTED_JOB&refId=qxRihemt7URafeYPCJRBUQ%3D%3D&trackingId=fgjE1gUVAfZQQVXJ9r58Jg%3D%3D&trk=flagship3_search_srp_jobs,Volvo Group,"Bengaluru, Karnataka, India",3817877512,"Transport is at the core of modern society. Imagine using your expertise to shape sustainable transport solutions for the future? If you seek to make a difference on a global scale, working with next-gen technologies and the sharpest collaborative teams, then we could be a perfect match.

What do we do?

We are the Simulation and Analytics Team within Volvo Group Trucks Technology, a dynamic team working towards enabling the Technology organization in evaluating futuristic products and services for Volvo business units such as trucks, buses, construction equipment and Marine

The main tasks in our team are to meet our customer’s expectation on quality, fuel consumption and to comply with emission legislation. This is done by selecting Engine HW-components and calibrate engine related functions. Upcoming emission legislation requires development of advanced control strategies together with an optimized hardware and software. You will be an important contributor in this development. Powertrain is the heart of the Truck and is one of the focus areas within Volvo Group, which is at the forefront of sustainable transport solutions for tomorrow.

We are on a mission to unleash the unimaginable power of Data…

Sound interesting? We want you to join us! What will you do? You will work in agile teams through good collaboration with our colleagues in software development and design teams all around the world.

You along with the team will be responsible for understanding customer usage and performance of our products and for providing our solutions throughout entire product life cycle, from idea investigation and concept evaluation to industrialization and to aftermarket and maintenance. You will make meaningful interpretations, recommendations and eventually predictions from the Data available from various sources to support our endeavor in moving towards Data Driven Powertrain Development

You get the opportunity to follow your Data Driven Models from script to test cell to verification in a truck and eventually to being used by our end customers.

We have an agile way of working, where each team plan their activities in sprints and deliver solutions together as a team. We strive to have an open and honest environment within the teams, where it is easy to ask each other for support when needed. The tasks can be either part of a larger project or short tasks to improve products currently in production.

You will get the opportunity to interact with highly committed colleagues from different cultures. We hope you will learn as much from us as we will from you.

Who are you?

We believe that to be successful in this position, you are a team player, have strong experience in data engineering and analysis area, and a will to deliver. You have a knowledge of control systems and feedback systems (closed loop) in general with an exposure to numerical and data driven simulation of a system. You must have a proven experience in Data modelling – Regression, Clustering, Neural Networks, Time series etc. and should have used them in solving real-life challenges (prediction, automation, real time optimization etc).

You have a willingness to learn and take more responsibility with can-do attitude.

You will be greatly appreciated in this role if you have demonstrated Predictive analysis and decision-making using Data.

If you are a Master’s Degree holder in Mechanical/Automobile/Electronics/Mechatronics Engineering with fantastic analytical skills, have gained a strong domain understanding in Powertrain Engineering with proven skills in handling and analysing large set of data to make meaningful interpretations and if you believe that you can work smoothly with Python ( including libraries like Numpy, SciPy, Pandas, Tensorflow) , R, SQL, Git, Azure, Hadoop and Matlab/Simulink, pySpark, C/C++/ Scala then you can be a good fit into this role.

Experience of working with relational databases, data privacy and understanding of IOT based instrumentation design with additional data logging to build or validate models is a big plus.

A passion for turning data into knowledge with great visualizations using Power BI, QlikView, Tableau and an experience of working with plant/ component models, and integration of these models into SIL/MIL/HIL evaluations would be an icing on the cake.

We value your data privacy and therefore do not accept applications via mail.

Who We Are And What We Believe In

Our focus on Inclusion, Diversity, and Equity allows each of us the opportunity to bring our full authentic self to work and thrive by providing a safe and supportive environment, free of harassment and discrimination. We are committed to removing the barriers to entry, which is why we ask that even if you feel you may not meet every qualification on the job description, please apply and let us decide.

Applying to this job offers you the opportunity to join Volvo Group. Every day, across the globe, our trucks, buses, engines, construction equipment, financial services, and solutions make modern life possible. We are almost 100,000 people empowered to shape the future landscape of efficient, safe and sustainable transport solutions. Fulfilling our mission creates countless career opportunities for talents with sharp minds and passion across the group’s leading brands and entities.

Group Trucks Technology are seeking talents to help design sustainable transportation solutions for the future. As part of our team, you’ll help us by engineering exciting next-gen technologies and contribute to projects that determine new, sustainable solutions. Bring your love of developing systems, working collaboratively, and your advanced skills to a place where you can make an impact. Join our design shift that leaves society in good shape for the next generation.
Show more Show less"
Data Scientist,https://www.linkedin.com/jobs/view/4025440369/?eBP=BUDGET_EXHAUSTED_JOB&refId=qxRihemt7URafeYPCJRBUQ%3D%3D&trackingId=wcTQ3ki7GJ%2BFO%2FftxahopA%3D%3D&trk=flagship3_search_srp_jobs,Flipkart,"Bengaluru, Karnataka, India (Hybrid)",4025440369,"About The Team

The Data Sciences team at Flipkart is on a mission to build systemic intelligence across Flipkart products and the overarching ecosystem. Being India’s largest online marketplace and the most used e-commerce app in India, places Flipkart in a unique position and gives this team a distinctive opportunity — to decipher the richest possible data about Indian consumers. Add the dimension of a vast product selection and a proliferating seller base to that and what you get is a multitude of disruptive possibilities.

In a nutshell, the terabytes of daily data compounded in Flipkart’s data centres offer a dynamic mix of numerical, structured, unstructured, image- and audio-based statistics, all set to define shopping in the future.

At Flipkart, the work of a Data Scientist involves collaboration with the engineering and product teams to ensure a holistic outcome at the product delivery. The flat functional structure within Flipkart engineering enables data scientists to focus on excellence and create a deep sense of ownership at every stage of work.

If you aspire to redefine ‘state-of-the-art’ and create an impact on India’s online shopping landscape, Flipkart’s Data Science team can offer you the right podium to solve challenging real-world problems and take a giant leap in your career as a Data Scientist.

About The Role

A Data Scientist in Flipkart is required to develop and implement ML or statistical models for the various projects formulated from business and product views. The responsible person should be able to communicate and collaborate with multiple stakeholders representing various teams to better understand the problem at hand. At a fundamental level, the responsible person should be able to dive deep into a problem statement and extract interesting insights as well as solutions. In addition to being a quick learner, a DS is expected to get involved in active research projects with a view to publish them.

What you’ll do

Understand Business and product needs and use ML or statistical techniques to provide solutions to those in a time bound fashion.
Communicate and collaborate with business and product teams to have a better understanding of the project so as to be able to drive it within the DS team.
Get involved in in-depth exploration of solutions using various methods and extract statistical insights from data as well as models, which are to be shared with business and product teams.
Active participation in working with new methods and learning new technologies, both in the area of data science and data engineering.

What You’ll Need

B.Tech or M.Tech in CS or Statistics with experience ranging from 3 to 5 years through publications/deployed solutions/projects.
Deep understanding of the algorithms (theory and application) that they have worked on.
Good grasp on the theory and practise of basic statistical models such as regression or clustering and general ML algorithms such as tree, Random Forests, SVM, Boosting, Neural Networks etc. It is not expected that the candidate has actually worked on all these modules.
Strong proficiency in Python or R is necessary.
Show more Show less"
Data Scientist III,https://www.linkedin.com/jobs/view/4019123395/?eBP=CwEAAAGR8LYmUqELv8UpAHiTeTz8b1lipQghQFYpZF7Sy7cAs4l4Y23MQFDsrfa8qUR-jrA2r8SIrURk7-1j15lRC9OkvjYsP5zdq1wv_NvF2VNQjQSFcVNXB_kRghv0HTzaf81-owNurW89TOmEPDIvRebj0w7o7sK8BElOnI3NW6IBnf1CgWb9E1yIsLOt1UEZ3esT48fGY85GfJdbNtJCrBXN-bSZtkIuWb5TUhAhYmjKmMbAXi9tkRTr_OJnsoDkILqE2FBBF3yP19SrC_9tnure3QwbimzdPB64itrsvC-norQDnbxNO7mbJ9VwrkH1wchz3fNxQUUv5Grk6cszmwFq-NXp0ke_QMtxBtErefBItVT8pItvYUKaM24UkiPNTrdIYqENsUP4n-YsdH2027b4KwzZB9I_cZpfKqo1spm0a3ZP69mmrmu3-feLrQ&refId=qxRihemt7URafeYPCJRBUQ%3D%3D&trackingId=KbyuuFkZRvDwxZKaeE5XjQ%3D%3D&trk=flagship3_search_srp_jobs,Credit Karma,"Bengaluru, Karnataka, India (Hybrid)",4019123395,"Intuit Credit Karma is a mission-driven company, focused on championing financial progress for our more than 130 million members globally. While we're best known for pioneering free credit scores, our members turn to us for everything related to their financial goals, including identity monitoring, applying for credit cards, shopping for insurance and loans (car, home and personal) and savings accounts and checking accounts* -- all for free. Credit Karma has grown significantly through the years: we now have more than 1,700 employees across our offices in Oakland, Charlotte, Culver City, San Diego, London and New York City.

Banking services provided by MVB Bank, Inc., Member FDIC

What You’ll Do

Work with other DS members to identify high-impact opportunities to demonstrate our extensive data to better serve our users
Participate in projects/initiatives to accelerate revenue advancement through disruptive and continuous improvements in various data science models (targeting, approval odds, marketing campaigns, etc.), feature engineering including user profiles and behavior, personalization, etc.
Be a strong contributor in our industry-first data science / machine learning platform for financial institutions, to enable certainty of approval for 100+ million consumers!
Partner with Marketing and engineering teams to ensure proper model adoption and tests. Be able to identify opportunities to iterate models based on business needs.
Participate research efforts with other team members to explore the frontiers of Deep Learning, Recommender systems, and other areas, as they apply to Personal Finance

What’s Great About The Role

You will work with large scale Machine Learning Models to optimize for Personal Finance Products
You will build on top of cutting edge backend ingestion pipelines and strong support from Machine Learning Engineering.
You will work within high growth data science team which directly impact the business and members
You will experience both personal and professional growth as you encourage growth throughout the team

Minimum Basic Requirement

Advanced Degree (BE/B.Tech/M.Tech/ME/Ph.D.) in Computer Science, Mathematics, Statistics, Physics or a related quantitative discipline
BE/B.Tech/M.Tech/ME with 2+ years of experience in Data Science, Machine Learning and related areas, with Fintech companies. Or PhD graduates in Finance or Data Science with a strong analytical background.
3+ years of experience programming skills in Python commercially (mandatory).
3+ years of experience Knowledge of PySpark, google cloud platform (GCP) and Scala will be plus.

Preferred Qualifications

You possess experience with Finance data (credit record data, loan underwriting) and familiar with data quality control and governance in the financial field.
Ambitious, results oriented, hardworking and creative thinker
Authoritative knowledge of Python, R and SQL, as well as ML systems such as TensorFlow, Torch, etc.
You have experience with advanced modeling techniques and Machine learning techniques in production and knowledge of maintaining and ramping these variants.
You have experience with A/B tests and solid analytical skills and communication skills.
You have various techniques in Deep Learning and Experimentation a plus
You have optimizing business outcomes in hyper-growth Internet companies (predictive science, ad yield management, marketplaces, etc) a huge plus

Equal Employment Opportunity

Credit Karma is proud to be an Equal Employment Opportunity Employer. We welcome all candidates without regard to race, color, religion, age, marital status, sex (including pregnancy, childbirth, or related medical condition), sexual orientation, gender identity or gender expression, national origin, veteran or military status, disability (physical or mental), genetic information or other protected characteristic. We prohibit discrimination of any kind and operate in compliance with applicable fair chance laws.

Credit Karma is also committed to a diverse and inclusive work environment because it is the right thing to do. We believe that such an environment advances long-term professional growth, creates a robust business, and supports our mission of championing financial progress for everyone. We offer generous benefits and perks with a single eye to nourishing an inclusive environment that recognizes the contributions of all and fosters diversity by supporting our internal Employee Resource Groups. We’ve worked hard to build an intensely collaborative and creative environment, a diverse and inclusive employee culture, and the opportunity for professional growth. As part of the Credit Karma team, your voice will be heard, your contributions will matter, and your unique background and experiences will be celebrated.

Privacy Policies

Credit Karma is strongly committed to protecting personal data. Please take a look below to review our privacy policies:

GDPR Privacy Policy
U.S. Job Applicant Privacy Notice
Show more Show less"
Data Scientist,https://www.linkedin.com/jobs/view/4017527266/?eBP=CwEAAAGR8LYmUq-1ZGmW406ACNJYARfKOrqO8eRKCm_Y23B6nPuF_nxZSiFfZLPyzc7WGmW1Qjy5yqBKzZHUdr1_KMkJfhyLvW1d2S-C_PAFSczMjMTeCBkh_lnp-suhTEGzGrnpwrBaHmasfR7bszoxNiWMYiGvZRFEW8M780_EcCtKSxUVRHjE6gj8qPeFhokEPpHK0PlQcuZwsVKGuhkmbNpU9-XtFQB2gZjjoJui092aChOeiIUOMuJfsNg3-1LuN3rwufTXX5JfFWIJ2eJkmWX7MrjRFJZ4n4fF7qIL-lMvHo-WKPYGj0ohIq9SPW052-T_d2JtxlHzyH9agdCRCLAp0X1Muh-NfsfHAHY2oUcoSb1gIJ3zMGseD5dS0yB0fe-n6Ib27cou02D-SXuRRHyAyULosF2StJwXs-xAT9_lYkBAsvpPbRpW7KloAGF0wrUSWn-3S__EQVQPN1VqEdiB6gZA4SKXoGjbI69o1tE&refId=qxRihemt7URafeYPCJRBUQ%3D%3D&trackingId=vYj6FxybASVug%2Blz50px1Q%3D%3D&trk=flagship3_search_srp_jobs,Tecnicas Reunidas,"Bengaluru, Karnataka, India (On-site)",4017527266,"About the Job:

Técnicas Reunidas is a world leading international general contractor engaged in the engineering and construction of industrial facilities in the fields of Oil & Gas, Petrochemical, Power Generation, Energy Transition, Infrastructures and industries, etc. Tecnicas Reunidas has worked and built all over the world, in 60 countries of the 5 continents.

Professionals with relevant design experience in the industry sectors of Oil & Gas, Refinery, Power Plant, and Petrochemical and having good knowledge in the following activities:

Data Scientist:

We're seeking a skilled Senior Python Developer with expertise in generative AI, data processing, computer vision, document parsing, and advanced software engineering to join our dynamic team. The ideal candidate will have a strong background in backend and frontend development, cloud technologies, containerization, artificial intelligence, data pipeline management, image processing, and document handling.

Key Responsibilities:
- Design, develop, and maintain robust Python-based applications
- Implement and optimize backend services using FastAPI
- Develop and manage Azure cloud infrastructure
- Create and maintain SQL databases, including advanced query optimization
- Implement task queues and background job processing with Celery
- Containerize applications using Docker for consistent deployment
- Develop responsive and intuitive user interfaces using HTML and CSS - Integrate and develop generative AI models and applications
- Design and implement Retrieval-Augmented Generation (RAG) systems
- Create and maintain ETL (Extract, Transform, Load) pipelines for data processing, with a focus on document parsing and information extraction

Required Skills and tools:
- 5+ years of experience in Python development
- Proficiency in Azure cloud services, MS Graph and infrastructure management
- Advanced knowledge of SQL and database optimization techniques
- Experience with Docker containerization and orchestration
- Familiarity with Celery for distributed task processing
- Strong background in FastAPI for building high-performance APIs
- Advanced HTML and CSS skills for frontend development
- Knowledge of generative AI techniques and frameworks (e.g., TensorFlow, PyTorch)
- Experience with Retrieval-Augmented Generation (RAG) systems
- Proficiency in designing and implementing ETL processes
- Strong understanding of data structures and algorithms
- Experience with computer vision libraries and frameworks (e.g., OpenCV, TensorFlow Object Detection API)
- Knowledge of image processing techniques and machine learning for computer vision
- Expertise in document parsing and information extraction from various file formats (e.g., PDF, XLSX, CSV, DOCX, XML, JSON)
- Experience with Natural Language Processing (NLP) techniques for text extraction and analysis with HuggingFace Transformers.

Preferred Qualifications:
- Experience with microservices architecture
- Knowledge of DevOps practices and CI/CD pipelines
- Familiarity with Agile development methodologies
- Familiarity with data warehousing concepts and technologies
- Experience with deep learning architectures for computer vision (e.g., CNNs, R-CNNs)
- Knowledge of 3D computer vision techniques and point cloud processing
- Understanding of camera calibration and image registration techniques
- Experience with OCR (Optical Character Recognition) technologies
Show more Show less"
Data Scientist,https://www.linkedin.com/jobs/view/4023880846/?eBP=CwEAAAGR8LYmU5TxdhPItwZoOnhCJsumImpFuHzUk0t84D5E4mehUvfpnu9YWKu0m62hAy_-OEJknk8T6yAAm9EBnW2FlkWLH7qdWuGRSDH7a14hMKZeCyBOZrJ3MAB04Tng3m7jiIozYVdHRgMSzArdK9vjA58WisHh8u2AkOgxhrbyCkxbRaiwUMDqX58NvMi7o68xGxP5ZWOjjeJA7-7ufxOqLbg8jLM-uGLOPgd_D0DiyBKz96YVk-jyUfiujjusyedtdV-b_ZzghIzFSKndT-_Yy-qvWZedy1k1c01CKS5zO24qLlHcnCnvb4DYGFmxzTu2qQyyhZoWVcSpNfpWYAAo1JJS20cczHf-dp8JuIIhErsqxSqCG4xvloCRcI2D3f3dyKriMZ_0xxa9lJXfuOLxxm2RpwTtZIQnEvANIfqUXshT4mtP7NiICTn2EiCsEPQy0WieFOEckXMgJJs7HpM&refId=qxRihemt7URafeYPCJRBUQ%3D%3D&trackingId=JcaYfjL8ZDdqIp0v4Wri0g%3D%3D&trk=flagship3_search_srp_jobs,Arista Networks,"Pune, Maharashtra, India (Hybrid)",4023880846,"Company Description

Arista Networks is an industry leader in data-driven, client-to-cloud networking for large data center, campus and routing environments. Arista is a well-established and profitable company with over $5 billion in revenue. Arista’s award-winning platforms, ranging in Ethernet speeds up to 800G bits per second, redefine scalability, agility, and resilience. Arista is a founding member of the Ultra Ethernet consortium. We have shipped over 20 million cloud networking ports worldwide with CloudVision and EOS, an advanced network operating system. Arista is committed to open standards, and its products are available worldwide directly and through partners.

At Arista, we value the diversity of thought and perspectives each employee brings. We believe fostering an inclusive environment where individuals from various backgrounds and experiences feel welcome is essential for driving creativity and innovation.

Our commitment to excellence has earned us several prestigious awards, such as the Great Place to Work Survey for Best Engineering Team and Best Company for Diversity, Compensation, and Work-Life Balance. At Arista, we take pride in our track record of success and strive to maintain the highest quality and performance standards in everything we do.

Job Description

Who You’ll Work With

Arista is excited to scale the WiFi Team in the Pune Development Center to take it’s Cognitive WiFi solution to the next level. Arista has ambitious plans to grow the Pune-based Development Center in the next couple of years and now is a great time to join the team when you can have a significant impact on the shape and direction as the office grows.

What You’ll Do

Work with the Cognitive WiFi team to research and develop techniques for anomaly detection, root cause analysis and auto remediation.
Develop ML models and measure their effectiveness across all of Arista’s customers.
Work on extracting and analyzing data from a wide variety of Wi-Fi networks.
Develop proof of concepts and ship new features in Arista’s CloudVision Wi-Fi solution.
Possibly share the findings with a larger community through talks and blog posts.

Qualifications

Bachelor’s degree in computer science or a related field.
Minimum 8 years of experience in Data Science, Machine Learning and AI technologies.
Knowledge of Python or R and SQL.
Knowledge of Pandas (Python) or Tidyverse (R) libraries.
Experience in using Jupyter or RStudio/RMarkdown notebooks.

Additional Information

Arista stands out as an engineering-centric company. Our leadership, including founders and engineering managers, are all engineers who understand the principles of sound software engineering and the importance of doing things right.

We hire globally into our diverse team. At Arista, engineers have complete ownership of their projects. Our management structure is flat and streamlined, and software engineering is led by those who understand it best. We prioritize the development and utilization of test automation tools.

Every part of the company is accessible to our engineers, providing opportunities to work across various domains. Arista is headquartered in Santa Clara, California, with development offices in Australia, Canada, India, Ireland, and the US. We consider all our R&D centers equal in stature.

Join us to shape the future of networking and be part of a culture that values invention, quality, respect, and fun.
Show more Show less"
