Job Title,Job Post Url,Company Name,Location,Job ID,Job Descriptions
Data Scientist - II,https://www.linkedin.com/jobs/view/4016136119/?eBP=CwEAAAGR8LYg_hLnbiTucFsPjLnGvbi5DJwQlDgUw0KtsjlpZftGWCcTeJGUhz_soi9mZh-Vwwe_UgW4f19CnS6bMJ5qqCMWJea7JpXt6grMRXKf63yQjwLLCSl2hm3SI7PoCK3UhK36_Go9o4j-7gqAQMadFlMm4CroxL0YPC8V8qHSy5TILDCSssC1hXCY56YQeodWhEaACfTrmrUU2mD9uG2L9sXyB-0faluTphoPJsj4SQN5vJVhkbEHWNnkpZw719F6SwwW83MXcG8aBTE9HwsqsJ6RP9xFjQHvWZHAD6pXcqJnoAe0bub_4KpWOErVUjpUyVRSCGJ9993Ww0MeHTH_BXBA6N45TqsWgQ0HPEhhAuDwgrt-1lK5WT8CEkQWQa9GLtxYsU_3bPWl4f_jGNLLAG5WXHvRG54J917Y5-M0a81qY79vNtGZ1_r2Rt1IiSnCeojjbmku7k-ZjQoMAMw0VE2u31c6c17xVg&refId=F8PxQ22KB1Tkuy1IzJ7mqg%3D%3D&trackingId=rEIBS5eRE%2BQdRa2a0%2BHlXg%3D%3D&trk=flagship3_search_srp_jobs,Netomi,"Gurugram, Haryana, India (Hybrid)",4016136119,"At Netomi AI, we are on a mission to create artificial intelligence that builds customer love for the world’s largest global brands.

Some of the largest brands are already using Netomi AI’s platform to solve mission-critical problems. This would allow you to work with top-tier clients at the senior level and build your network.

Backed by the world’s leading investors such as Y-Combinator, Index Ventures, Jeffrey Katzenberg (co-founder of DreamWorks) and Greg Brockman (co-founder & President of OpenAI/ChatGPT), you will become a part of an elite group of visionaries who are defining the future of AI for customer experience. We are building a dynamic, fast growing team that values innovation, creativity, and hard work. You will have the chance to significantly impact the company’s success while developing your skills and career in AI.

Want to become a key part of the Generative AI revolution? We should talk.

Netomi is a Y-Combinator and VC-backed Artificial Intelligence company that sits at the intersection of two rapidly developing fields: AI and customer service. Our clients include Fortune 1,000 companies. Our artificial intelligence platform gives customer service teams the ability to activate, manage & train their AI to deliver an experience that delights consumers and turns customer service into a competitive advantage.

We care about building a company that not only has the best technology and product on the market but also provides superior service to our customers.

Want to have a direct impact in solving the top challenges businesses face today? Join us!

Job Description:

Do you believe in the missions Intelligence agencies? Are you interested in solving complex programmatic and technical issues?

If you are interested in working on some of the most challenging technical and programmatic issues , we are interested in talking to you about Netomi work and career opportunities.

As a Senior Data Scientist at Netomi, you will drive NLP and machine learning projects and be responsible for developing methodology and solutions to support technical, analytical and operational requirements.

Job Responsibilities
Design, develop and deploy machine learning models and algorithms for NLP/LLMs or deep learning models at scale to solve complex business problems.
Work with large datasets, perform data analysis and develop data pipelines to support model development.
Collaborate with Product & Engineering teams to integrate machine learning solutions into products and services.
Conduct experiments, test hypotheses, and perform statistical analysis to validate models and drive improvements.
Communicate findings and insights to stakeholders in a clear and concise manner.
Stay up-to-date with the latest developments in machine learning, NLP/LLMs, deep learning, and related technologies.
Provide technical mentorship and guidance to junior team members.

Requirements
3+ years of experience as a data scientist, preferably in a product development environment, with a focus on building NLP/LLMs or Deep Learning models.
Strong programming skills in Python or other relevant programming languages.
Experience with machine learning libraries (e.g., scikit-learn, TensorFlow, PyTorch).
Deep understanding of statistical analysis, probability theory, and experimental design.
Experience with LLMs, deep learning, NLP and chatbot development.
Excellent communication skills, including the ability to explain complex concepts to technical and non-technical stakeholders.
Experience working with a variety of statistical models, including logistic regression, clustering, classification, SVMs, neural networks, Random Forest, CRF, Bayesian models, supervised/unsupervised learning, etc.
Expertise in NLP techniques, including sentiment analysis, word embedding, part-of-speech (POS) tagging, topic modeling, text classification, machine translation, speech recognition, named entity recognition (NER), natural language generation (NLG), and other related techniques.
Experience with various deep learning techniques, including CNNs and RNNs, and a strong understanding of building and training these models for different applications. Familiarity with LMs and LLMs such as GPT, BERT, and Transformer models is highly desirable.
Strong ability to rapidly comprehend and implement research papers related to AI, as well as remain informed of the latest advancements in NLP technologies.
Deep knowledge and experience in structured and unstructured data Information Extraction, Knowledge Information Retrieval, and Knowledge Representation.
Self-motivated and driven to satisfy intellectual curiosity through the pursuit of continuous learning and skill development.
Strong problem-solving and analytical skills.
Optional: Experience with large-scale data processing technologies (e.g., Hadoop, Spark) and distributed computing systems.

Netomi is an equal opportunity employer committed to diversity in the workplace. We evaluate qualified applicants without regard to race, color, religion, sex, sexual orientation, disability, veteran status, and other protected characteristics.
Show more Show less"
Data Scientist III,https://www.linkedin.com/jobs/view/4000034404/?eBP=CwEAAAGR8LYg_hx1r1CXRn5DovD-9BjOese0O_TotQPsEvLiUfdeAF6StWJsHH-SQopwn_DzLoK_45euKaLL1D35KHrESBtq26TCvOAywu7k87MlV8tkeoloTv4-XNhltfrh-v9qnKb-hLZ7MYbbSf-6jzFQi_yRCTVaCb4degisotCssJpwoLlWVI0r-RBpEk9-tNZ-EqT3Dg07sZvlRCyh9ZAyQ1hNPzck-sYpxQWLCg_IECssJWW7Orm4lDGCvIDSGTWv2mIFf-v5DMzCg81SxpUdEuLxHvEp3AxN21VX5UpWbVM1fNomGNt-WsjcPkPAy9fY2o1C68-YNTj9WVuN661rXReiyvpqupTtkV8D5ZsvPRoCWeuB4l1SQ50K1hZ_lLpEYDFVkMRwAkYOWluLE39DBIMUzcyG7iDm4egOgk0jw1H4V9Ni1kPnBqvFXhY6VFdtHKEON15dWrGVHonWB4XGEk_7CQ92Wss&refId=F8PxQ22KB1Tkuy1IzJ7mqg%3D%3D&trackingId=CPNqr6gdBU%2FzBv%2FH16FHIA%3D%3D&trk=flagship3_search_srp_jobs,Granicus,"Bengaluru, Karnataka, India (Hybrid)",4000034404,"We are seeking an experienced Data Scientist III to join our team. In this role, you will manage the entire data science lifecycle, including data acquisition, preparation, model development, deployment, and monitoring. You will apply advanced techniques in Python programming, machine learning (ML), deep learning (DL), and generative AI to address complex challenges and develop high-impact solutions. Your role will involve leading projects, collaborating with cross-functional teams, and driving data-driven decision-making across the organization.

What your impact will look like here:
Advanced Model Development: Design, develop, and implement sophisticated machine learning and deep learning models for applications such as customer churn prediction, recommendation systems, and advanced anomaly detection.
Programming and Libraries: Utilize Python and its advanced libraries (e.g., TensorFlow, PyTorch, Scikit-learn) to build and optimize models.
Generative AI Exploration: Leverage cutting-edge generative AI techniques to create innovative solutions for complex problems and enhance engagement strategies.
Leadership and Collaboration: Lead cross-functional teams, including product managers, engineers, and data analysts, to translate business needs into effective data-driven solutions.
Integration and Deployment: Oversee the integration of models into production systems, ensuring seamless deployment and performance.
Pipeline Management: Develop and maintain robust data pipelines for ingestion, transformation, and model training.
Performance Monitoring: Continuously monitor model performance, conduct evaluations, and implement improvements as necessary.
Communication and Strategy: Communicate complex technical concepts clearly to stakeholders and contribute to strategic data science initiatives.
Best Practices and Innovation: Drive the development of best practices, tools, and frameworks for data science and machine learning, staying abreast of industry advancements.

You will love this job if you have:
Bachelor’s or Master’s degree in Computer Science, Statistics, Mathematics, or a related quantitative field.
4-7 years of experience in data science, machine learning, or a relevant domain.
Proficiency in Python programming and extensive experience with relevant libraries (e.g., TensorFlow, PyTorch, Scikit-learn).
Proven track record of delivering production-ready AI/ML solutions.
Strong expertise in machine learning and deep learning algorithms and techniques.
Experience with generative AI models and advanced data science techniques.
Proficiency in data manipulation, analysis, and visualization using Python libraries (e.g., Pandas, NumPy, Matplotlib).
Experience with cloud platforms and big data technologies (e.g., AWS).
Excellent problem-solving, analytical, and leadership skills.
Strong communication and collaboration skills, with the ability to explain complex technical concepts to diverse audiences.


The Team
We area globally distributed workforce across the United States, Canada, United Kingdom, India, Armenia, Australia, and New Zealand.
 The Culture
At Granicus, we are building a transparent, inclusive, and safe space for everyone who wants to be a part of our journey. A few culture highlights include –
-        Employee Resource Groups to encourage diverse voices
-        Coffee with Mark sessions – Our employees get to interact with our CEO on very important and sometimes difficult issues ranging from mental health to work life balance and current affairs.
-        Embracing diversity & fostering a culture of ideation, collaboration & meritocracy
-        We bring in special guests from time to time to discuss issues that impact our employee population
The Company
Serving the People Who Serve the People
Granicus is driven by the excitement of building, implementing, and maintaining technology that is transforming the Govtech industry by bringing governments and its constituents together. We are on a mission to support our customers with meeting the needs of their communities and implementing our technology in ways that are equitable and inclusive. Granicus has consistently appeared on the GovTech 100 list over the past 5 years and has been recognized as the best companies to work on BuiltIn.
Over the last 25 years, we have served 5,500 federal, state, and local government agencies and more than 300 million citizen subscribers power an unmatched Subscriber Network that use our digital solutions to make the world a better place. With comprehensive cloud-based solutions for communications, government website design, meeting and agenda management software, records management, and digital services, Granicus empowers stronger relationships between government and residents across the U.S., U.K., Australia, New Zealand, and Canada. By simplifying interactions with residents, while disseminating critical information, Granicus brings governments closer to the people they serve—driving meaningful change for communities around the globe.
Want to know more? See more of what we do here.
The Impact
We are proud to serve dynamic organizations around the globe that use our digital solutions to make the world a better place — quite literally. We have so many powerful success stories that illustrate how our solutions are impacting the world. See more of our impact here.
The Process
-        Assessment – Take a quick assessment.
-        Phone screen – Speak to one of our talented recruiters to ensure this could be a fit.
-        Hiring Manager/Panel interview – Talk to the hiring manager so they can learn more about you and you about Granicus. Meet more members on the team! Learn more and share more.
-        Reference checks – Provide 2 references so we can hear about your awesomeness.
-        Verbal offer – Let’s talk numbers, benefits, culture and answer any questions.
-        Written offer – Sign a formal letter and get excited because we sure are!
Benefits at Granicus India
Along with the challenges of the job, Granicus offers employees an attractive benefits package which includes –
-        Hospitalization Insurance Policy covering employees and their family members including parents
-        All employees are covered under Personal Accident Insurance & Term Life Insurance policy
-        All employees can avail annual health check facility 
-        Eligible for reimbursement of telephone and internet expenses
-        Wellness Allowance to avail health club memberships and/or access to physical fitness centres
-        Wellbeing Wednesdays which includes 1x global Unplug Day and 2x No Meeting Days every quarter
-        Memberships for ‘meditation and mindfulness ‘ apps including on-demand mental health support 24/7 
-        Access to learning management system Say., LinkedIn Learning Premium account membership & many more
-        Access to Rewards & recognition portal and quarterly recognition program
 Security and Privacy Requirements
-        Responsible for Granicus information security by appropriately preserving the Confidentiality, Integrity, and Availability (CIA) of Granicus information assets in accordance with the company's information security program.
-        Responsible for ensuring the data privacy of our employees and customers, their data, as well as taking all required privacy training in a timely manner, in accordance with company policies. 
  Granicus is committed to providing equal employment opportunities. All qualified applicants and employees will be considered for employment and advancement without regard to race, color, religion, creed, national origin, ancestry, sex, gender, gender identity, gender expression, physical or mental disability, age, genetic information, sexual or affectional orientation, marital status, status regarding public assistance, familial status, military or veteran status or any other status protected by applicable law.
Show more Show less"
Data Scientist,https://www.linkedin.com/jobs/view/4017818543/?eBP=CwEAAAGR8LYg_vGenMMEXD_-bGwKheFueNvJW-Q7XUKgY-tYs4Vf7hjdZrVUcz_j_dvhkqGS8gFqg5YEGygA-CAf3c9kxIAFwzurRIMzzrO8hEYdCh0_nSKsq4iHE2AJdO2pHOj15_59H4f9DQi9ciHhPlaG8ntpanAu8mhOBuetA94z0XAUZEpTdg1LuoXX3DHyDOGbDHwrQpTHfCIM-UN8oVH8MoGNkVqr99WWU9kWlgQGkoP2ewKRKilGh8gFclQfAp41fGHG5QTtiTvjN44JewsNy1t_E8TQCCdg7pD1F4Lb15n7dL6gi4LdFlIyz_vp0y9yjLG9ldosUPgQLNU77xi7GKdvQRiPV0SezlhlNjghy77wJrs7p4asL_z2ocGTaQFcTFrrXNNhQdtPhRoJoVZXqJJo5V90EW1rVV4UQi5IevnRwc5e6Z1T8uWAPQ&refId=F8PxQ22KB1Tkuy1IzJ7mqg%3D%3D&trackingId=gVPh45ZhD4%2FlZGi0jC1rkQ%3D%3D&trk=flagship3_search_srp_jobs,IBM,"Bengaluru East, Karnataka, India (Hybrid)",4017818543,"Introduction

As a Data Scientist at IBM, you will help transform our clients’ data into tangible business value by analyzing information, communicating outcomes and collaborating on product development. Work with Best in Class open source and visual tools, along with the most flexible and scalable deployment options. Whether it’s investigating patient trends or weather patterns, you will work to solve real world problems for the industries transforming how we live.

Your Role and Responsibilities

Data powers the insights companies use to transform the way they work. Do you enjoy analyzing data to push marketers to take actions that improve their performance? Do you have proven experience finding actionable insights in large data sets that lead to measurable business results?


The Performance Intelligence org directly impacts the direction of the marketing organization and all of IBM. We provide insights that drive both strategic and tactical outcomes for the company and directly guide marketing execution.
We are looking to implement the vision of an automated AI Data Analyst that consolidates access to insights and visualization of marketing data, using AI assistant technology that will reliably serve information to executive leadership and decision makers in marketing
In this role, you will have the opportunity to utilize your experience and specialization in data science and AI to accelerate our delivery timeline in the development of advanced generative AI use cases in the organization.
Use the latest AI tools and libraries to unlock the power of AI as an enabler for better insights of our performance data
Utilize various IBM and open source frameworks to develop AI multi agent workflows for data analysis and visualization and implement plus deploy AI automation solutions
Develop, design and present data-driven optimization recommendations via dashboards, reports, and analyses
Work with other team members, marketing groups, and IBM leadership to onboard new AI use cases and capabilities.


Required Technical and Professional Expertise


6+ years of relevant data science work experience in complex data querying and work with complex data models using Advanced SQL/Python or other query and programming tools to process and analyze data.
Experience with AI foundational technologies: LLM, watsonx (or other platforms), prompt engineering, Langchain, vector databases, RAG, chainlit/streamlit.
Demonstrates a strong ability to leverage AI tools to implement intelligent assistants, automation, and retrieval augmented generation.
Thought leadership in working on functional objectives and shaping a solution.
Ability to translate business requirements into technical solution
Familiarity with Microservices architecture, infrastructure concepts and cloud platforms AWS, Azure, IBM Cloud, or Google Cloud.


Preferred Technical And Professional Expertise


Master’s degree in Data Science / Computer Programming is a strong plus.
Relevant work experience in marketing analytics and web analytics is a plus.


About Business Unit

IBM Corporate Headquarters (CHQ) team represents a variety of functions such as marketing, finance, legal, operations, HR, and more, all working together to solve some of the world's most complex problems, help our clients achieve success and build collaborative work environments for IBMers.

This job requires you to be fully COVID-19 vaccinated prior to your start date and proof of vaccination status will be required before your start date. During the Onboarding process you will be asked to confirm your vaccination status, in case you are unable to get vaccinated for any reason, you can let us know at that stage. Please let us know if you are unable to be vaccinated due to medical or religious reasons. IBM will consider such requests on a case by case basis subject to submission of required proof by the candidate before a stipulated date.

Your Life @ IBM

In a world where technology never stands still, we understand that, dedication to our clients success, innovation that matters, and trust and personal responsibility in all our relationships, lives in what we do as IBMers as we strive to be the catalyst that makes the world work better.

Being an IBMer means you’ll be able to learn and develop yourself and your career, you’ll be encouraged to be courageous and experiment everyday, all whilst having continuous trust and support in an environment where everyone can thrive whatever their personal or professional background.

Our IBMers are growth minded, always staying curious, open to feedback and learning new information and skills to constantly transform themselves and our company. They are trusted to provide on-going feedback to help other IBMers grow, as well as collaborate with colleagues keeping in mind a team focused approach to include different perspectives to drive exceptional outcomes for our customers. The courage our IBMers have to make critical decisions everyday is essential to IBM becoming the catalyst for progress, always embracing challenges with resources they have to hand, a can-do attitude and always striving for an outcome focused approach within everything that they do.

Are you ready to be an IBMer?

About IBM

IBM's greatest invention is the IBMer. We believe that through the application of intelligence, reason and science, we can improve business, society and the human condition, bringing the power of an open hybrid cloud and AI strategy to life for our clients and partners around the world.

Restlessly reinventing since 1911, we are not only one of the largest corporate organizations in the world, we’re also one of the biggest technology and consulting employers, with many of the Fortune 50 companies relying on the IBM Cloud to run their business.

At IBM, we pride ourselves on being an early adopter of artificial intelligence, quantum computing and blockchain. Now it’s time for you to join us on our journey to being a responsible technology innovator and a force for good in the world.

Location Statement

When applying to jobs of your interest, we recommend that you do so for those that match your experience and expertise. Our recruiters advise that you apply to not more than 3 roles in a year for the best candidate experience.

For additional information about location requirements, please discuss with the recruiter following submission of your application.

Being You @ IBM

IBM is committed to creating a diverse environment and is proud to be an equal-opportunity employer. All qualified applicants will receive consideration for employment without regard to race, color, religion, sex, gender, gender identity or expression, sexual orientation, national origin, caste, genetics, pregnancy, disability, neurodivergence, age, veteran status, or other characteristics. IBM is also committed to compliance with all fair employment practices regarding citizenship and immigration status.
Show more Show less"
